{
  "schemaVersion": "v1",
  "readinessId": "readiness_asset_jup_limited_live",
  "subjectKind": "asset",
  "subjectKey": "JUP",
  "targetState": "limited_live_ready",
  "status": "pass",
  "summary": "asset:JUP cleared limited_live_ready readiness with 7/7 passing checks.",
  "venueKey": "jupiter",
  "assetKey": "JUP",
  "checks": [
    {
      "checkId": "capability-coverage",
      "status": "pass",
      "observedValue": "jupiter:shadow,paper,live",
      "thresholdValue": "live support",
      "message": "Venue capability covers bounded live execution."
    },
    {
      "checkId": "data-quality",
      "status": "pass",
      "observedValue": "datasets=2,features=4",
      "thresholdValue": "datasets>0,features>0",
      "message": "Historical dataset and feature coverage are available for readiness review."
    }
  ],
  "evidenceRefs": [
    {
      "kind": "data_quality_snapshot",
      "ref": "dataset:snapshot_2026_03_07_seed",
      "notes": "dataset_feed_replay_sol_usdc_market_events"
    },
    {
      "kind": "cost_model_coverage",
      "ref": "cost-model:cost_model_jupiter_sol_usdc_spot"
    },
    {
      "kind": "paper_lifecycle_coverage",
      "ref": "backtest:backtest_alloc_dca_report"
    },
    {
      "kind": "allowlist_change",
      "ref": "subject-control:asset:JUP"
    },
    {
      "kind": "bounded_canary_plan",
      "ref": "canary-plan:jupiter:JUP/USDC:jupiter"
    }
  ],
  "controls": {
    "venue": {
      "schemaVersion": "v1",
      "subjectKind": "venue",
      "subjectKey": "jupiter",
      "liveAllowed": false,
      "killSwitchEnabled": false,
      "updatedAt": "2026-03-11T12:00:00.000Z"
    },
    "asset": {
      "schemaVersion": "v1",
      "subjectKind": "asset",
      "subjectKey": "JUP",
      "liveAllowed": false,
      "killSwitchEnabled": false,
      "updatedAt": "2026-03-11T12:00:00.000Z"
    }
  },
  "createdAt": "2026-03-11T12:00:00.000Z",
  "updatedAt": "2026-03-11T12:00:00.000Z",
  "metadata": {
    "requestedBy": "codex",
    "pairSymbol": "JUP/USDC",
    "adapterKey": "jupiter"
  }
}
